Nombre,313,314,463,811,532,,,,313,Fabricación de insumos textiles y acabado de textilesT 
Sastrería La Estrella,8562,9854,251,-126,20,,,,314,"Fabricación de productos textiles, excepto prendas de vestirT "
Sastrería Los Ases,4159,6236,56,-459,-56,,,,463,"Comercio al por menor de productos textiles, bisutería, accesorios de vestir y calzado "
Sastreria Nacho,7963,4896,123,-1987,-89,,,,811,Servicios de reparación y mantenimientoT 
Sastrería Doña Martha,5269,2367,-568,-136,-78,,,,532,Servicios de alquiler de bienes mueblesT 
Sastrería Nova,4896,1968,-987,-258,-32,,,,,
