,,,,,,,,,
Nombre.,334,531,435,515,721,,,Tiendas de cómputo y electrónica.,
“Eléctrica y electrónica Pablito”,-43922,-5343,123439,-3276,-2388,,,334,"Fabricación de equipo de computación, comunicación, medición y de otros equipos, componentes y accesorios electrónicosT"
Tienda de computación “Core”,-23282,-6443,102933,-5783,-2455,,,531,Servicios inmobiliarios
Tienda de componentes electrónicos “Caimán”,-12932,-2344,67899,-3127,-1938,,,435," Comercio al por mayor de maquinaria, equipo y mobiliario para actividades agropecuarias, industriales, de servicios y comerciales, y de otra maquinaria y equipo de uso general"
Distribuidor de componentes eléctricos y electrónicos “La resistencia”.,-34337,-7432,98373,-4433,-1223,,,515,Radio y televisión
Tienda de accesorios de cómputo “El programador”.,-34432,-6345,87223,-8272,-2893,,,721,Servicios de alojamiento temporal
